Source Content,"Technology, AI, Ethics","Environment, Climate Change","Technology, Smartphones, IoT","Health, Mental Health","Science, Space Exploration",,,,,,,,,,
Artificial intelligence (AI) is no longer just a f...,0.5505,0.1263,0.3649,0.1818,0.1673
Climate change is one of the most pressing issues ...,0.1462,0.5301,0.1443,0.1217,0.1649
The rapid advancement of technology has revolution...,0.4693,0.1660,0.6598,0.1440,0.2124
Mental health is an integral part of overall well-...,0.2484,0.1698,0.2389,0.5592,0.0919
Space exploration has always captured the imaginat...,0.2245,0.1552,0.2133,0.0978,0.5895
